{
  "schema_version": "1.1.0",
  "title": "A-014 报告模板共享骨架 — 章顺序 + 字段必含清单 + 5 scale x 4 象限交集字段表",
  "decision_ref": "spec.md §Decision 6.1",
  "adr_ref": "docs/adr/0006-shared-skeleton-scale-slice.md",
  "blocked_by": "#05",
  "quadrants": [
    "structure",
    "behavior",
    "supply_chain",
    "strategy"
  ],
  "scales": [
    "MACRO-A",
    "MACRO-B",
    "MACRO-C",
    "MICRO-A",
    "MICRO-B"
  ],
  "skeleton": {
    "locked": true,
    "rule": "章集合与章顺序严格锁定，共 4 章，ordinal 1..4 连续无重复，不得增删、不得重排、不得用“约 4 章”等模糊表述",
    "chapters": [
      {
        "id": "C1",
        "name": "执行摘要",
        "ordinal": 1,
        "locked": true,
        "purpose": "一屏给出审计对象、粒度、综合裁决与置信度；读者只读本章即可知道结论",
        "fields": [
          {
            "name": "report_id",
            "type": "string",
            "required": true,
            "description": "报告唯一标识，写入 fact table，作为跨 scale 聚合主键之一"
          },
          {
            "name": "schema_version",
            "type": "string(semver)",
            "required": true,
            "description": "本骨架契约版本，与 14-skeleton.schema.json 对齐"
          },
          {
            "name": "scale",
            "type": "enum[MACRO-A|MACRO-B|MACRO-C|MICRO-A|MICRO-B]",
            "required": true,
            "description": "审计粒度档位（ADR-0001 五档）"
          },
          {
            "name": "subject_ref",
            "type": "string",
            "required": true,
            "description": "审计对象定位符：repo@sha / PR# / 文件路径:行"
          },
          {
            "name": "generated_at",
            "type": "string(date-time)",
            "required": true,
            "description": "报告生成时刻，ISO 8601 UTC"
          },
          {
            "name": "correlation_key",
            "type": "string(32)",
            "required": true,
            "description": "trace_id/baggage_id（A-010），用于跨 scale 关联同一 commit/PR 的审计记录"
          },
          {
            "name": "overall_verdict",
            "type": "enum[pass|warn|fail|insufficient]",
            "required": true,
            "description": "综合裁决；insufficient 表示信号不足（对齐 S5 单人仓降权门语义）"
          },
          {
            "name": "confidence",
            "type": "number(0-1)",
            "required": true,
            "description": "裁决置信度；低于协议阈值时 overall_verdict 必须为 insufficient"
          },
          {
            "name": "headline",
            "type": "string",
            "required": true,
            "description": "一句话结论（措辞不锁，长度上限 200 字符）"
          },
          {
            "name": "top_findings",
            "type": "array[string]",
            "required": true,
            "description": "指向 C3 证据条目的 evidence_id，至少 1 项"
          },
          {
            "name": "degraded_mode",
            "type": "boolean",
            "required": true,
            "description": "是否处于降级产出；true 时走 A-018 failure path 语义并必带降级说明"
          },
          {
            "name": "stale_data_marker",
            "type": "enum[fresh|warn|stale|unknown]",
            "required": true,
            "description": "陈旧数据标记本体（A-009）；fresh=投影延迟 ≤ SLA，warn=超 warn 阈值，stale=超 error 阈值或投影停滞，unknown=探测失败（fail-closed）"
          },
          {
            "name": "staleness_sla_seconds",
            "type": "number",
            "required": true,
            "description": "本次报告生效的陈旧读 SLA（数字，秒；按 scale 取自 A-009 per_scale 表，默认 5）"
          },
          {
            "name": "read_model_lag_seconds",
            "type": "number",
            "required": true,
            "description": "实测投影延迟（秒）= now - fact 表 MAX(recorded_at)；字段名与 A-012 metric 逐字对齐"
          },
          {
            "name": "read_model_version",
            "type": "integer",
            "required": true,
            "description": "该 read model 已投影到的 fact 版本（控制表 read_model_state.last_processed_version）"
          },
          {
            "name": "fact_watermark_version",
            "type": "integer",
            "required": true,
            "description": "fact 表最新水位版本 = MAX(fact.version)"
          }
        ]
      },
      {
        "id": "C2",
        "name": "四象限与裁决",
        "ordinal": 2,
        "locked": true,
        "purpose": "按 structure → behavior → supply_chain → strategy 固定顺序给出四象限结论与 verdict-gate 印记",
        "fields": [
          {
            "name": "quadrants",
            "type": "array[QuadrantBlock](4)",
            "required": true,
            "description": "恰好 4 项，顺序锁定：structure → behavior → supply_chain → strategy"
          },
          {
            "name": "quadrant",
            "type": "enum[structure|behavior|supply_chain|strategy]",
            "required": true,
            "description": "象限标识（ADR-0001 四象限）"
          },
          {
            "name": "applicability",
            "type": "enum[native|projected|not_applicable]",
            "required": true,
            "description": "该象限在本 scale 的适用形态；native=原生有效，projected=由其他 scale 投影/聚合推得，not_applicable=无信号"
          },
          {
            "name": "verdict",
            "type": "enum[pass|warn|fail|insufficient]|null",
            "required": true,
            "description": "象限裁决；applicability=not_applicable 时必须为 null"
          },
          {
            "name": "score",
            "type": "number|null",
            "required": true,
            "description": "象限评分；为 null 时必须配合 verdict=insufficient"
          },
          {
            "name": "confidence",
            "type": "number|null",
            "required": true,
            "description": "象限置信度"
          },
          {
            "name": "dimensions",
            "type": "array[DimensionRef]",
            "required": true,
            "description": "关联维度引用；strategy 象限为 S1-S5（指向 #05 25 格矩阵），其余象限可空数组"
          },
          {
            "name": "slice_fields",
            "type": "object",
            "required": true,
            "description": "该 (scale, quadrant) 交集字段实例，键集由本文件 cells 表严格锁定"
          },
          {
            "name": "verdict_gate.protocol_version",
            "type": "string",
            "required": true,
            "description": "Adjudication Protocol 版本（code-as-policy，ADR-0005）"
          },
          {
            "name": "verdict_gate.decision",
            "type": "enum[accepted|rejected|overridden|insufficient]",
            "required": true,
            "description": "裁决结果"
          },
          {
            "name": "verdict_gate.evidence_threshold_met",
            "type": "boolean",
            "required": true,
            "description": "是否达到证据门槛"
          },
          {
            "name": "verdict_gate.decided_at",
            "type": "string(date-time)",
            "required": true,
            "description": "裁决时刻"
          },
          {
            "name": "verdict_gate.override_reason",
            "type": "string|null",
            "required": true,
            "description": "非 overridden 时必须为 null"
          },
          {
            "name": "verdict_gate.audit_ref",
            "type": "string",
            "required": true,
            "description": "审计日志指针，保证裁决可追溯"
          },
          {
            "name": "conflict_markers",
            "type": "array[ConflictMarker]",
            "required": true,
            "description": "跨 scale 冲突标记（无冲突时为空数组，字段本身不可缺省）"
          }
        ]
      },
      {
        "id": "C3",
        "name": "证据",
        "ordinal": 3,
        "locked": true,
        "purpose": "承载全部被引用的证据条目，每条必带 grounded 引文校验盖章与可重放定位",
        "fields": [
          {
            "name": "evidence_items",
            "type": "array[EvidenceItem](>=1)",
            "required": true,
            "description": "证据条目，至少 1 项"
          },
          {
            "name": "evidence_id",
            "type": "string",
            "required": true,
            "description": "证据唯一标识，供 C1 top_findings 与 C4 evidence_refs 引用"
          },
          {
            "name": "source",
            "type": "enum[codelore|openssf_scorecard|git|adr_scan|repomix|manual]",
            "required": true,
            "description": "证据来源"
          },
          {
            "name": "locator",
            "type": "string",
            "required": true,
            "description": "定位符：file:line / commit sha / scorecard check 名"
          },
          {
            "name": "claim",
            "type": "string",
            "required": true,
            "description": "该证据支撑的断言"
          },
          {
            "name": "grounded",
            "type": "enum[verified|unverified]",
            "required": true,
            "description": "引文校验盖章（ADR-0006 的 ✓/⚠ 语义）：verified=已校验，unverified=未校验"
          },
          {
            "name": "collected_at",
            "type": "string(date-time)",
            "required": true,
            "description": "证据采集时刻"
          },
          {
            "name": "reproduce_cmd",
            "type": "string|null",
            "required": true,
            "description": "可重放命令；为 null 时 reproduce_absent_reason 必填"
          },
          {
            "name": "reproduce_absent_reason",
            "type": "string|null",
            "required": false,
            "description": "条件必填：仅当 reproduce_cmd 为 null 时必填"
          }
        ]
      },
      {
        "id": "C4",
        "name": "行动建议",
        "ordinal": 4,
        "locked": true,
        "purpose": "给出可行动建议，每条必带 verdict-gate 印记；未通过裁决的建议必须显式标 unverified",
        "fields": [
          {
            "name": "recommendations",
            "type": "array[Recommendation]",
            "required": true,
            "description": "建议条目"
          },
          {
            "name": "rec_id",
            "type": "string",
            "required": true,
            "description": "建议唯一标识"
          },
          {
            "name": "priority",
            "type": "enum[P0|P1|P2]",
            "required": true,
            "description": "优先级"
          },
          {
            "name": "action",
            "type": "string",
            "required": true,
            "description": "建议动作"
          },
          {